{
  "schema_name": "sustentra_intake_profile_schema",
  "schema_version": "0.1.1",
  "status": "seed",
  "description": "Machine-readable seed of the intake profile schema: one entry per data point in intake/profile_schema_mapping.md (v0.2), sections 1-8. This file is configuration, not code - the interview engine, evidence-request compiler and profile page all read it. It defines NO new emissions data points: every entry either populates an existing methodology field, sets an intake-only state/content field, or triggers a J2 evidence request.",
  "derived_from": {
    "mapping": "intake/profile_schema_mapping.md",
    "mapping_version": "0.2",
    "spec": "intake/SPEC.md",
    "spec_version": "1.0",
    "repo_rules": "CLAUDE.md"
  },
  "validation": {
    "contract": "intake/contracts/profile_schema.schema.json",
    "field_index": "intake/config/methodology_field_index.json",
    "validator": "intake/scripts/validate_profile_schema.py"
  },
  "design_contracts": [
    "Every populates entry of target_type 'methodology_field' must resolve to a field_id present in intake/config/methodology_field_index.json, and each schema_field must be one of that field's real Data_Schema_Field(s).",
    "Every evidence_triggered ID must be a J2 evidence type ID present in reference-data/config/libraries/evidence_type_library.json.",
    "question_content_ref values are placeholders. Final plain-language wording, explainers and the film vocabulary overlay are authored after the Vocabulary Library review (SPEC section 10) and are not part of this seed.",
    "Entries with provisional true encode a proposed default that is NOT yet methodologically approved. They must surface for expert review (Todd) and must never be silently applied as settled - CLAUDE.md rule 6.",
    "class_source records whether the escalation class came from the mapping or was inferred by implementation and still needs confirmation.",
    "applicability.condition_ref names a condition defined in applicability_conditions. Evaluation logic is deterministic application code built in Phase C; this seed only names the conditions.",
    "A negative screening answer produces a 'screened, not present' completeness record (intake state), never an EXC-010 exclusion. EXC-010 is reserved for sources that exist and are excluded on materiality grounds."
  ],
  "open_items": {
    "pending_expert_signoff": {
      "owner": "Todd",
      "source": "intake/SPEC.md section 10; intake/profile_schema_mapping.md self-check",
      "datapoint_ids": [
        "BND-2.1",
        "BND-2.4",
        "BND-2.6",
        "BND-2.7",
        "MRT-7.1",
        "MRT-7.2",
        "MRT-7.3",
        "MRT-7.4",
        "MRT-7.5"
      ]
    },
    "pending_class_confirmation": {
      "note": "The mapping does not assign an escalation class to these entries; the class below was inferred during Phase A and needs founder/expert confirmation.",
      "datapoint_ids": ["S1FUG-5.5", "PRV-8.1", "PRV-8.2"]
    },
    "mapping_shorthand_resolved": [
      {
        "datapoint_id": "SEED-1.3",
        "mapping_text": "FAC-010 (... period_in_scope)",
        "resolution": "FAC-010 exposes period_in_scope_start and period_in_scope_end; both are encoded. Mapping wording is a shorthand, not a missing field.",
        "needs_founder_note": true
      },
      {
        "datapoint_id": "SEED-1.5",
        "mapping_text": "Legacy audit_setup.facility_type",
        "resolution": "Real legacy path is company_and_facility_profile.facility_type in legacy-schemas/copied_from_streamlit_demo/audit_setup.schema.json.",
        "needs_founder_note": true
      }
    ],
    "not_in_scope_v1": {
      "note": "SPEC section 8 scope cuts. Recorded here so the exclusion is traceable rather than silently absent.",
      "datapoint_ids": ["S1FUG-5.5"]
    }
  },
  "sections": [
    {
      "section_id": "seed_form",
      "order": 1,
      "stage": 1,
      "mapping_section": "1",
      "label": "Seed form",
      "delivery": "structured_form",
      "description": "Stage 1 structured intake. No chat."
    },
    {
      "section_id": "boundary",
      "order": 2,
      "stage": 2,
      "mapping_section": "2",
      "label": "Boundary",
      "delivery": "guided_interview",
      "description": "Boundary block. HUMAN class unless noted; human-confirmed before lock."
    },
    {
      "section_id": "scope1_stationary",
      "order": 3,
      "stage": 2,
      "mapping_section": "3",
      "label": "Scope 1 - stationary combustion",
      "delivery": "guided_interview",
      "description": "Per-site screening for fuel-burning equipment."
    },
    {
      "section_id": "scope1_mobile",
      "order": 4,
      "stage": 2,
      "mapping_section": "4",
      "label": "Scope 1 - mobile",
      "delivery": "guided_interview",
      "description": "Per-entity screening for vehicles and motorized equipment."
    },
    {
      "section_id": "scope1_fugitive",
      "order": 5,
      "stage": 2,
      "mapping_section": "5",
      "label": "Scope 1 - fugitives and process",
      "delivery": "guided_interview",
      "description": "Per-site screening for refrigerants, fire suppression, industrial gases and process sources."
    },
    {
      "section_id": "scope2",
      "order": 6,
      "stage": 2,
      "mapping_section": "6",
      "label": "Scope 2",
      "delivery": "guided_interview",
      "description": "Per-site imported energy: electricity, district energy, self-generation, instruments."
    },
    {
      "section_id": "method_routing",
      "order": 7,
      "stage": 2,
      "mapping_section": "7",
      "label": "Method routing defaults",
      "delivery": "system_assigned",
      "description": "SME path cut. SYSTEM class, verifier-overridable, never asked of the client."
    },
    {
      "section_id": "provenance",
      "order": 8,
      "stage": 2,
      "mapping_section": "8",
      "label": "Provenance and data quality",
      "delivery": "system_assigned",
      "description": "Applies to every data point above: source/provenance capture and category-level uncertainty."
    }
  ],
  "applicability_conditions": {
    "always": {
      "description": "Always applicable within its grain.",
      "expression": null
    },
    "industry_is_film": {
      "description": "Client's industry overlay is the film production overlay (SEED-1.4).",
      "expression": null
    },
    "more_than_one_legal_entity": {
      "description": "The org comprises more than one legal entity. Skipped entirely for single-entity SMEs.",
      "expression": null
    },
    "prior_inventories_exist": {
      "description": "The client has previously prepared a GHG inventory, so base year is not simply the first reporting year.",
      "expression": null
    },
    "stationary_or_mobile_fuel_present": {
      "description": "A positive answer to stationary fuel use, generators, or a mobile fleet, so fuel blend composition matters.",
      "expression": null
    },
    "screening_answer_negative": {
      "description": "A screening question in sections 3-6 was answered 'no'; triggers a completeness record rather than an exclusion.",
      "expression": null
    },
    "mobile_fleet_present": {
      "description": "The client owns or leases vehicles or motorized equipment (S1MOB-4.1 positive).",
      "expression": null
    },
    "selling_energy_or_attributes": {
      "description": "The client sells self-generated power or its environmental attributes, creating double-counting risk.",
      "expression": null
    },
    "answer_is_yes": {
      "description": "The client answered 'yes' to the screening question on this data point.",
      "expression": null
    }
  },
  "datapoints": [
    {
      "datapoint_id": "SEED-1.1",
      "mapping_ref": "1.1",
      "section": "seed_form",
      "kind": "question",
      "grain": "org",
      "label": "Company legal name + reporting year",
      "class": "AUTO",
      "class_source": "mapping",
      "v1_status": "active",
      "provisional": false,
      "applicability": { "condition_ref": "always" },
      "populates": [
        {
          "target_type": "methodology_field",
          "field_id": "INV-010",
          "schema_fields": ["legal_reporting_entity_id", "reporting_year"]
        }
      ],
      "evidence_triggered": [],
      "escalation_triggers": [],
      "question_content_ref": "intake.questions.seed_form.company_identity",
      "reasoning": "Anchor keys for the whole inventory; every S1/S2 record joins back to INV-010.",
      "notes": []
    },
    {
      "datapoint_id": "SEED-1.2",
      "mapping_ref": "1.2",
      "section": "seed_form",
      "kind": "question",
      "grain": "org",
      "label": "Responsible party: name, role, email of the person accountable for the inventory",
      "class": "AUTO",
      "class_source": "mapping",
      "v1_status": "active",
      "provisional": false,
      "applicability": { "condition_ref": "always" },
      "populates": [
        {
          "target_type": "intake_field",
          "field_path": "profile.responsible_party",
          "intake_fields": ["name", "role", "email"]
        }
      ],
      "evidence_triggered": [],
      "escalation_triggers": [],
      "question_content_ref": "intake.questions.seed_form.responsible_party",
      "reasoning": "ISO 14064-1 report content requires naming the responsible party. Doubles as the client-side escalation contact for the alert pipeline.",
      "notes": [
        "Added in mapping v0.2 (audit FAIL 6).",
        "Surfaces in report content; no methodology field ID holds this today."
      ]
    },
    {
      "datapoint_id": "SEED-1.3",
      "mapping_ref": "1.3",
      "section": "seed_form",
      "kind": "question",
      "grain": "site",
      "label": "Sites: name, full address, status",
      "class": "AUTO",
      "class_source": "mapping",
      "v1_status": "active",
      "provisional": false,
      "applicability": { "condition_ref": "always" },